{
  "$schema": "http://json-schema.org/draft-07/schema#",
  "$id": "https://open-relay.local/schemas/review-response.schema.json",
  "title": "Open Relay Review Response Packet",
  "type": "object",
  "additionalProperties": false,
  "required": [
    "packet_version",
    "packet_type",
    "created_at",
    "response_to",
    "reviewer",
    "outcome",
    "confidence",
    "summary",
    "findings",
    "reviewed_scope",
    "verification",
    "redactions",
    "next_action"
  ],
  "properties": {
    "packet_version": {
      "type": "string",
      "const": "0.1"
    },
    "packet_type": {
      "type": "string",
      "const": "review-response"
    },
    "created_at": {
      "type": "string",
      "pattern": "^\\d{4}-\\d{2}-\\d{2}T\\d{2}:\\d{2}:\\d{2}(?:\\.\\d{3})?Z$"
    },
    "response_to": {
      "$ref": "#/definitions/responseTo"
    },
    "reviewer": {
      "$ref": "#/definitions/reviewer"
    },
    "outcome": {
      "type": "string",
      "enum": [
        "approved",
        "changes_requested",
        "commentary",
        "blocked"
      ]
    },
    "confidence": {
      "type": "string",
      "enum": [
        "high",
        "medium",
        "low"
      ]
    },
    "summary": {
      "type": "string",
      "minLength": 1
    },
    "findings": {
      "type": "array",
      "items": {
        "$ref": "#/definitions/finding"
      }
    },
    "reviewed_scope": {
      "$ref": "#/definitions/reviewedScope"
    },
    "verification": {
      "type": "array",
      "items": {
        "$ref": "#/definitions/verification"
      }
    },
    "provenance": {
      "type": "array",
      "items": {
        "$ref": "#/definitions/provenance"
      }
    },
    "redactions": {
      "type": "array",
      "items": {
        "$ref": "#/definitions/redaction"
      }
    },
    "sensitive_data": {
      "$ref": "#/definitions/sensitiveData"
    },
    "next_action": {
      "type": "string",
      "minLength": 1
    }
  },
  "definitions": {
    "responseTo": {
      "type": "object",
      "additionalProperties": false,
      "required": [
        "packet_type",
        "packet_version",
        "repository",
        "working_branch",
        "base_commit",
        "head_commit",
        "diff_range"
      ],
      "properties": {
        "packet_type": {
          "type": "string",
          "minLength": 1
        },
        "packet_version": {
          "type": "string",
          "minLength": 1
        },
        "repository": {
          "type": "string",
          "minLength": 1
        },
        "working_branch": {
          "type": "string",
          "minLength": 1
        },
        "base_commit": {
          "type": "string",
          "minLength": 1
        },
        "head_commit": {
          "type": "string",
          "minLength": 1
        },
        "diff_range": {
          "type": "string",
          "minLength": 1
        },
        "pull_request_url": {
          "type": "string",
          "minLength": 1
        },
        "storage_id": {
          "type": "string",
          "minLength": 1
        },
        "source": {
          "type": "string",
          "minLength": 1
        }
      }
    },
    "reviewer": {
      "type": "object",
      "additionalProperties": false,
      "required": [
        "name",
        "kind"
      ],
      "properties": {
        "name": {
          "type": "string",
          "minLength": 1
        },
        "kind": {
          "type": "string",
          "enum": [
            "agent",
            "human",
            "unknown"
          ]
        },
        "tool": {
          "type": "string",
          "minLength": 1
        },
        "requested_by": {
          "type": "string",
          "minLength": 1
        }
      }
    },
    "finding": {
      "type": "object",
      "additionalProperties": false,
      "required": [
        "id",
        "severity",
        "blocking",
        "title",
        "description",
        "evidence",
        "recommendation"
      ],
      "properties": {
        "id": {
          "type": "string",
          "minLength": 1
        },
        "severity": {
          "type": "string",
          "enum": [
            "high",
            "medium",
            "low",
            "info"
          ]
        },
        "blocking": {
          "type": "boolean"
        },
        "title": {
          "type": "string",
          "minLength": 1
        },
        "description": {
          "type": "string",
          "minLength": 1
        },
        "evidence": {
          "type": "string",
          "minLength": 1
        },
        "recommendation": {
          "type": "string",
          "minLength": 1
        },
        "location": {
          "$ref": "#/definitions/location"
        }
      }
    },
    "location": {
      "type": "object",
      "additionalProperties": false,
      "required": [
        "path"
      ],
      "properties": {
        "path": {
          "type": "string",
          "minLength": 1
        },
        "line": {
          "type": "integer",
          "minimum": 1
        },
        "symbol": {
          "type": "string",
          "minLength": 1
        }
      }
    },
    "reviewedScope": {
      "type": "object",
      "additionalProperties": false,
      "required": [
        "files",
        "limitations"
      ],
      "properties": {
        "files": {
          "type": "array",
          "items": {
            "$ref": "#/definitions/reviewedFile"
          }
        },
        "limitations": {
          "type": "array",
          "items": {
            "type": "string",
            "minLength": 1
          }
        }
      }
    },
    "reviewedFile": {
      "type": "object",
      "additionalProperties": false,
      "required": [
        "path"
      ],
      "properties": {
        "path": {
          "type": "string",
          "minLength": 1
        },
        "notes": {
          "type": "string",
          "minLength": 1
        }
      }
    },
    "verification": {
      "type": "object",
      "additionalProperties": false,
      "required": [
        "kind",
        "command",
        "result",
        "evidence"
      ],
      "properties": {
        "kind": {
          "type": "string",
          "enum": [
            "command",
            "ci",
            "manual",
            "external"
          ]
        },
        "command": {
          "type": "string",
          "minLength": 1
        },
        "result": {
          "type": "string",
          "enum": [
            "passed",
            "failed",
            "not_run",
            "unknown"
          ]
        },
        "evidence": {
          "type": "string",
          "minLength": 1
        }
      }
    },
    "provenance": {
      "type": "object",
      "additionalProperties": false,
      "required": [
        "type",
        "reference",
        "supports"
      ],
      "properties": {
        "type": {
          "type": "string",
          "enum": [
            "pull_request",
            "ci_run",
            "commit",
            "issue",
            "user_note",
            "external_url"
          ]
        },
        "reference": {
          "type": "string",
          "minLength": 1
        },
        "supports": {
          "type": "string",
          "minLength": 1
        }
      }
    },
    "redaction": {
      "type": "object",
      "additionalProperties": false,
      "required": [
        "field",
        "reason"
      ],
      "properties": {
        "field": {
          "type": "string",
          "minLength": 1
        },
        "reason": {
          "type": "string",
          "minLength": 1
        },
        "replacement": {
          "type": "string",
          "minLength": 1
        }
      }
    },
    "sensitiveData": {
      "type": "object",
      "additionalProperties": false,
      "required": [
        "excluded",
        "notes"
      ],
      "properties": {
        "excluded": {
          "type": "boolean"
        },
        "notes": {
          "type": "string",
          "minLength": 1
        }
      }
    }
  }
}
